{
  "filingProfileId": "F3_ORIGINAL_1200",
  "labels": {
    "de": "Originaleingang bis 12.00 Uhr",
    "fr": "Réception de l'original jusqu'à 12 h 00"
  },
  "preservationMode": "originalReceipt",
  "deadlineDimension": "dateAndTime",
  "acceptedChannels": ["competentAuthority"],
  "acceptedEvidence": ["authorityReceipt"],
  "originalRequired": true,
  "cutoffTime": "12:00:00",
  "timezone": "Europe/Zurich",
  "sourceRefs": [
    { "sourceId": "SRC-PRV-BE-CURRENT", "locator": "Art. 66" }
  ]
}
